[
    {
        "title": "Aanvrager",
        "key": "aanvrager",
        "path": "doc:aanvrager.naam",
        "displayType": {
            "type": "text",
            "displayTypeParameters": {}
        },
        "sortable": false,
        "order": 0
    },
    {
        "title": "E-mail",
        "key": "email",
        "path": "doc:aanvrager.email",
        "displayType": {
            "type": "text",
            "displayTypeParameters": {}
        },
        "sortable": false,
        "order": 1
    },
    {
        "title": "Status",
        "key": "status",
        "path": "doc:status",
        "displayType": {
            "type": "text",
            "displayTypeParameters": {}
        },
        "sortable": true,
        "order": 2
    },
    {
        "title": "Gemigreerd vanaf",
        "key": "migratedFrom",
        "path": "doc:migratedFrom",
        "displayType": {
            "type": "text",
            "displayTypeParameters": {}
        },
        "sortable": false,
        "order": 3
    },
    {
        "title": "Aangemaakt",
        "key": "createdOn",
        "path": "case:createdOn",
        "displayType": {
            "type": "date",
            "displayTypeParameters": {
                "dateFormat": "DD-MM-YYYY"
            }
        },
        "sortable": true,
        "defaultSort": "DESC",
        "order": 4
    }
]
