[
    {
        "key": "createdOn",
        "path": "case:createdOn",
        "displayType": {
            "type": "date",
            "displayTypeParameters": {
                "dateFormat": null
            }
        },
        "sortable": true,
        "defaultSort": "DESC",
        "order": 0
    },
    {
        "key": "firstName",
        "path": "doc:firstName",
        "displayType": {
            "type": "text",
            "displayTypeParameters": {}
        },
        "sortable": true,
        "order": 1
    },
    {
        "key": "lastName",
        "path": "doc:lastName",
        "displayType": {
            "type": "text",
            "displayTypeParameters": {}
        },
        "sortable": true,
        "order": 2
    },
    {
        "key": "assigneeFullName",
        "path": "case:assigneeFullName",
        "displayType": {
            "type": "text",
            "displayTypeParameters": {}
        },
        "sortable": true,
        "order": 3
    }
]
